experiment_id	completed_at	commit	config	seed	machine	job_id	metric	value	run_status	decision	artifact_dir	description
003-orion-s0-ar-v1	2026-09-26T02:38:43.646175+00:00	8744b3a6122d2ac6962f251da51288139cb29278	configs/003_doob_speculative_decoding/native_orion.json	20260926	orion	4192661	completed_prompts	0	crash	repair_environment_path	/home/mlw0719/cola_dlm_exploration_storage/runs/003_doob_speculative_decoding/003-orion-s0-ar-v1	Startup failed before generation: installed ninja was not on PATH. No scientific outcome.
003-orion-s0-native-v1	2026-09-26T02:38:43.646175+00:00	8744b3a6122d2ac6962f251da51288139cb29278	configs/003_doob_speculative_decoding/native_orion.json	20260926	orion	4192666	completed_prompts	0	crash	repair_environment_path	/home/mlw0719/cola_dlm_exploration_storage/runs/003_doob_speculative_decoding/003-orion-s0-native-v1	Startup failed before generation: installed ninja was not on PATH. No scientific outcome.
003-orion-s0-ar-v2	2026-09-26T02:44:43.029352+00:00	00d1dd469c44f8f86dd2eda6806adc2336b65572	configs/003_doob_speculative_decoding/native_orion.json	20260926	orion	1056	completed_prompts	0	crash	repair_tokenizer_interface	/home/mlw0719/cola_dlm_exploration_storage/runs/003_doob_speculative_decoding/003-orion-s0-ar-v2	Models loaded successfully; generation input failed because chat-template return type was BatchEncoding. No model outcomes.
003-orion-s0-native-v2	2026-09-26T02:44:43.029352+00:00	00d1dd469c44f8f86dd2eda6806adc2336b65572	configs/003_doob_speculative_decoding/native_orion.json	20260926	orion	1125	completed_prompts	0	crash	repair_tokenizer_interface	/home/mlw0719/cola_dlm_exploration_storage/runs/003_doob_speculative_decoding/003-orion-s0-native-v2	Models loaded successfully; generation input failed because chat-template return type was BatchEncoding. No model outcomes.
003-orion-s0-ar-v3	2026-09-26T02:53:14.445148+00:00	083ccf165f0e08a5ac866d12a0b54fd6dafb7025	configs/003_doob_speculative_decoding/native_orion.json	20260926	orion	3112	completed_prompts	20	success	reference_only	/home/mlw0719/cola_dlm_exploration_storage/runs/003_doob_speculative_decoding/003-orion-s0-ar-v3	20 prompts generated; 11 AR/native output mismatches. The 72 retained graphs from matching prompts passed native walk and boundary checks. No acceleration claim.
003-orion-s0-native-v3	2026-09-26T02:53:14.445148+00:00	083ccf165f0e08a5ac866d12a0b54fd6dafb7025	configs/003_doob_speculative_decoding/native_orion.json	20260926	orion	3180	exact_match_prompts	9	invalid	repair_numerical_parity	/home/mlw0719/cola_dlm_exploration_storage/runs/003_doob_speculative_decoding/003-orion-s0-native-v3	20 prompts generated; 11 AR/native output mismatches. The 72 retained graphs from matching prompts passed native walk and boundary checks. No acceleration claim.
003-orion-s0-ar-v4	2026-09-26T03:06:39.051739+00:00	88d2e6573395419f010e9c19187ead4b53af510f	configs/003_doob_speculative_decoding/native_orion.json	20260926	orion	7050	exact_match_prompts	20	success	advance_to_development	/home/mlw0719/cola_dlm_exploration_storage/runs/003_doob_speculative_decoding/003-orion-s0-ar-v4	All 7353 greedy tokens match on 20 prompts. 160 retained graphs, 2031 captured rounds, 40 post-terminal rounds; no parity/walk/boundary failures. Interface evidence only.
003-orion-s0-native-v4	2026-09-26T03:06:39.051739+00:00	88d2e6573395419f010e9c19187ead4b53af510f	configs/003_doob_speculative_decoding/native_orion.json	20260926	orion	7118	exact_match_prompts	20	success	advance_to_development	/home/mlw0719/cola_dlm_exploration_storage/runs/003_doob_speculative_decoding/003-orion-s0-native-v4	All 7353 greedy tokens match on 20 prompts. 160 retained graphs, 2031 captured rounds, 40 post-terminal rounds; no parity/walk/boundary failures. Interface evidence only.
003-nebula-single-smoke-v1	2026-09-26T03:16:32.665061+00:00	cbe70986ec2b93dd49b8b1876e5e622fcac5e293	configs/003_doob_speculative_decoding/native_orion.json	20260926	nebula	919711	exact_match_prompts	2	success	advance_to_development	/home/mlw0719/cola_dlm_exploration_storage/runs/003_doob_speculative_decoding/003-nebula-single-smoke-v1	Two-prompt Nebula deployment matches the validated Orion AR reference; 525 identical output tokens, 16 retained graphs, 127 captured rounds, four post-terminal proposals. Deployment evidence only; collection times are not speedup evidence.
