experiment_id	completed_at	commit	config	seed	machine	job_id	metric	value	run_status	decision	artifact_dir	description
001-p0-engineering-v1	2026-09-14T02:55:52.823829+00:00	f9ecd7f2becfe104aeb455895461680d89ab848b	tests/check_cola_state.py	84001	nebula	1519438,1519443,1519448,1519453	passed_examples	32	success	keep	/home/mlw0719/cola_dlm_exploration_storage/runs/001_same_prefix_state/	32/32 engineering examples passed native parity and replay/cache invariants; implementation evidence only.
001-p0-calibration-easy-v2	2026-09-14T03:48:13.111147+00:00	3b1fb15cf78f234660169f5fcb1686d61286217b	configs/001_same_prefix_state/p0_calibration_easy.json	710000	nebula	1539322,1539330,1539347,1539357	route_success	0	success	inconclusive	/home/mlw0719/cola_dlm_exploration_storage/runs/001_same_prefix_state	512 samples on 128 graphs; parseable=0.824219; eligible=0; best-of-4=0. Capability gate fails; H1-H3 unmeasured.
001-p0-calibration-hard-v2	2026-09-14T03:48:13.111147+00:00	3b1fb15cf78f234660169f5fcb1686d61286217b	configs/001_same_prefix_state/p0_calibration_hard.json	710000	nebula	1539322,1539330,1539347,1539357	route_success	0	success	inconclusive	/home/mlw0719/cola_dlm_exploration_storage/runs/001_same_prefix_state	512 samples on 128 graphs; parseable=0.646484; eligible=0; best-of-4=0. Capability gate fails; H1-H3 unmeasured.
001-r0-saved-routes-v1	2026-09-14T04:27:15.483603+00:00	b01546b8badcb052e84026ff826a3d90ecc32b81	configs/001_same_prefix_state/r0_saved_routes.json	510001,510002	nebula	1646944	eligible_mixed_roots		crash	inconclusive	/home/mlw0719/cola_dlm_exploration_storage/runs/001_same_prefix_state/001-r0-saved-routes-v1	CPU audit stopped at task comparison before statistics; inspect tuple/list serialization, then retry. No new model generation.
001-r0-saved-routes-v2-easy	2026-09-14T04:32:04.746985+00:00	827285209957d870812bc4fe9b13f99345e2a2ab	configs/001_same_prefix_state/r0_saved_routes.json	510001	nebula	1650788	eligible_mixed_roots	76	success	keep	/home/mlw0719/cola_dlm_exploration_storage/runs/001_same_prefix_state/001-r0-saved-routes-v2	CPU reanalysis of 512 existing generations: no eligible causal F roots; M root eligibility is a token-prefix observation, not candidate acceptance or H1/H2 evidence.
001-r0-saved-routes-v2-hard	2026-09-14T04:32:04.746985+00:00	827285209957d870812bc4fe9b13f99345e2a2ab	configs/001_same_prefix_state/r0_saved_routes.json	510002	nebula	1650788	eligible_mixed_roots	61	success	keep	/home/mlw0719/cola_dlm_exploration_storage/runs/001_same_prefix_state/001-r0-saved-routes-v2	CPU reanalysis of 512 existing generations: no eligible causal F roots; M root eligibility is a token-prefix observation, not candidate acceptance or H1/H2 evidence.
001-r1-parity-smoke-v1	2026-09-14T04:43:02.373836+00:00	a97cf2c45b02adf27a7771d7365125ab4e2bbbe9	configs/001_same_prefix_state/r1_official_capability.json	66	nebula	1664981	paired_examples_passed	8	success	keep	/home/mlw0719/cola_dlm_exploration_storage/runs/001_same_prefix_state/001-r1-parity-smoke-v1	8/8 official/native-wrapper token parity and resume/rebuild checks pass at penalty 1.1; one default penalty-1.0 control passes. Engineering evidence, not full capability or H1 results.
001-r1-official-capability-v1-lambada	2026-09-14T04:53:54.550096+00:00	699dacde51720e02c34012b3ca0b57500ce94a48	configs/001_same_prefix_state/r1_official_capability.json	66	nebula	1673899,1673904,1673909	official_score_accuracy	0.4921875	success	keep	/home/mlw0719/cola_dlm_exploration_storage/runs/001_same_prefix_state	63/128 on fixed release-fixture inputs using pinned native inference/scorer, penalty1.1. Includes four exact-condition smoke records per task from a97cf2c. Capability only; H1a/H1b/H2/H3 unmeasured.
001-r1-official-capability-v1-squad	2026-09-14T04:53:54.550096+00:00	699dacde51720e02c34012b3ca0b57500ce94a48	configs/001_same_prefix_state/r1_official_capability.json	66	nebula	1673899,1673904,1673909	official_score_accuracy	0.3359375	success	keep	/home/mlw0719/cola_dlm_exploration_storage/runs/001_same_prefix_state	43/128 on fixed release-fixture inputs using pinned native inference/scorer, penalty1.1. Includes four exact-condition smoke records per task from a97cf2c. Capability only; H1a/H1b/H2/H3 unmeasured.
001-r3-m-engineering-v1	2026-09-14T05:00:17.159336+00:00	7e757d8e7f0bd5a6dd8fd9470225ef147ccc8002	tests/check_mixed_candidates.py	88000000+m*1000	nebula	1683790,1683806,1683815	engineering_cases_passed	16	success	keep	/home/mlw0719/cola_dlm_exploration_storage/runs/001_same_prefix_state	16/16 cases cover remainders 0..15 once; known latents, identity, ordering, replay and paired futures pass. Engineering only.
001-r3-payload-smoke-v1	2026-09-14T05:08:18.021940+00:00	3209858356d467e620e93e83ff93982e14666d0f	tests/check_natural_payload.py	91000000	nebula	1693616	payload_replay_cases_passed	2	success	keep	/home/mlw0719/cola_dlm_exploration_storage/runs/001_same_prefix_state/001-r3-payload-smoke-v1	F reference and M pair serialized/reloaded with identical caches and paired futures. Engineering only; not an effect estimate.
001-r3-eta-f-v1	2026-09-14T05:10:30.604861+00:00	3209858356d467e620e93e83ff93982e14666d0f	configs/001_same_prefix_state/r3_eta_f.json	91000000	nebula	1696121,1696126	selected_eta_paired_roots	5	success	keep	/home/mlw0719/cola_dlm_exploration_storage/runs/001_same_prefix_state	8 attempted roots; eta0.03 selected reward-blind; 5 accepted pairs, strict epsilon0.01. Distribution effects unmeasured.
001-r3-eta-m-v1	2026-09-14T05:10:30.604861+00:00	3209858356d467e620e93e83ff93982e14666d0f	configs/001_same_prefix_state/r3_eta_m.json	91000000	nebula	1696131,1696136	selected_eta_paired_roots	6	success	keep	/home/mlw0719/cola_dlm_exploration_storage/runs/001_same_prefix_state	8 attempted roots; eta0.03 selected reward-blind; 6 accepted pairs, strict epsilon0.01. Distribution effects unmeasured.
001-r4-measurement-smoke-v1	2026-09-14T05:17:18.165657+00:00	8e2ab3f19f7d6bcfa8ad1338e1a256d358f41278	tests/check_natural_measurement.py	310000000,410000000	nebula	1701823	independent_AB_runner_pass	1	success	keep	/home/mlw0719/cola_dlm_exploration_storage/runs/001_same_prefix_state/001-r4-measurement-smoke-v1	Real saved M pair: paired noise within splits, independent A/B, and exact identity null passed. Engineering case is not a formal distribution result.
001-r2-copy-v1	2026-09-14T05:29:39.564829+00:00	8e2ab3f19f7d6bcfa8ad1338e1a256d358f41278	configs/001_same_prefix_state/r2_copy.json	192000000+cell_offset	nebula	1702092	complete_route_success	0.046875	success	keep	/home/mlw0719/cola_dlm_exploration_storage/runs/001_same_prefix_state/001-r2-copy-v1	3/64 successful; M eligible52, F eligible3. Diagnostic only; no candidate value measurement.
001-r2-chain-v1	2026-09-14T05:29:39.564829+00:00	8e2ab3f19f7d6bcfa8ad1338e1a256d358f41278	configs/001_same_prefix_state/r2_chain.json	192000000+cell_offset	nebula	1702097	complete_route_success	0.0	success	keep	/home/mlw0719/cola_dlm_exploration_storage/runs/001_same_prefix_state/001-r2-chain-v1	0/64 successful; M eligible7, F eligible0. Diagnostic only; no candidate value measurement.
001-r2-branch-v1	2026-09-14T05:29:39.564829+00:00	8e2ab3f19f7d6bcfa8ad1338e1a256d358f41278	configs/001_same_prefix_state/r2_branch.json	192000000+cell_offset	nebula	1702102	complete_route_success	0.0	success	keep	/home/mlw0719/cola_dlm_exploration_storage/runs/001_same_prefix_state/001-r2-branch-v1	0/64 successful; M eligible8, F eligible0. Diagnostic only; no candidate value measurement.
001-r3-collection-f-v1	2026-09-14T05:33:14.879660+00:00	5d2d743cb4a3ae8ca92d834e9f48c906ac17838b	configs/001_same_prefix_state/r3_collection_f.json	91000000	nebula	1707720	paired_roots	27	success	keep	/home/mlw0719/cola_dlm_exploration_storage/runs/001_same_prefix_state/001-r3-collection-f-v1	27 new strict pairs from37 ordered roots8..44. Calibration adds5 pairs from8 roots;32 total F pairs. Adaptive stopping, descriptive coverage only.
001-r3-collection-m-v1	2026-09-14T05:37:03.676068+00:00	5d2d743cb4a3ae8ca92d834e9f48c906ac17838b	configs/001_same_prefix_state/r3_collection_m.json	91000000	nebula	1720652	paired_roots	26	success	keep	/home/mlw0719/cola_dlm_exploration_storage/runs/001_same_prefix_state/001-r3-collection-m-v1	26 new strict M pairs from33 ordered roots8..40;2 aligned prompts excluded. Calibration adds6/8;32 total M pairs from41 sources. Descriptive adaptive coverage.
001-r2-matched-full-v1	2026-09-14T05:47:15.202631+00:00	8e2ab3f19f7d6bcfa8ad1338e1a256d358f41278	configs/001_same_prefix_state/r2_matched_full.json	192000000+cell_offset	nebula	1720647	complete_route_success	0	success	keep	/home/mlw0719/cola_dlm_exploration_storage/runs/001_same_prefix_state/001-r2-matched-full-v1	0/64 full success;28/64 parseable,3/64 first-edge correct,2 M roots,0 F roots. No correct-trunk first-branch crossing.
001-r4-pilot-f-v1	2026-09-14T05:47:15.202631+00:00	91ff5b400bd6eda44456f9280b905c19eddd856e,fee6adf80ec1c791bd49556f045c9f2951cbf992	configs/001_same_prefix_state/r4_pilot_f.json	310000000,410000000	nebula	1722800,1725130,1724785	H_token	0	success	inconclusive	/home/mlw0719/cola_dlm_exploration_storage/runs/001_same_prefix_state	32 fixed F pairs;512 futures;source bootstrap95% CI[-0.000213623,0.000244141].156/256 paired suffixes differ; raw disagreement does not establish distribution difference. Proceed with fixed independent confirmation; positive-effect cache diagnostic not activated.
001-r2-branch-v1-layout-analysis	2026-09-14T06:11:30.914605+00:00	8e2ab3f19f7d6bcfa8ad1338e1a256d358f41278	scripts/audit_r2_layouts.py	920002	nebula		canonical_predecision_F_layouts	0	success	keep	experiments/001_same_prefix_state/results/r2_canonical_layouts_v1.json	Post-run CPU analysis of saved tasks;0/32 canonical Branch F layouts and26/32 M layouts. Other cells each32/32 F. No new model generations; geometry and capability must be distinguished.
001-r4-confirmation-f-v1	2026-09-14T06:51:38.888861+00:00	3f63ae20394b6c612910ab4c04cc2e8c194973b6	configs/001_same_prefix_state/r4_confirmation_f.json	510000000,610000000,710000000,810000000	nebula	1736037,1736042,1736047,1736052	H_token	-5.512852822580645e-05	success	inconclusive	/home/mlw0719/cola_dlm_exploration_storage/runs/001_same_prefix_state	128 fixed sources;127 live,93 paired,34 reference fallbacks,1 terminated.3520 futures;95% source CI[-0.00013950892857142856, 2.9518047691637536e-05].No positive H1a support;cache localization not activated.1520 proposals and all costs retained.
001-r5-branch-m-probe-v1	2026-09-14T06:55:18.174380+00:00	9df1226653d328effaff468d794121ad740dd785	configs/001_same_prefix_state/r5_branch_m_probe.json	890000000,910000000,1010000000	nebula	1779618,1778333,1780214,1780552	H_reward	0	success	inconclusive	/home/mlw0719/cola_dlm_exploration_storage/runs/001_same_prefix_state	8 fixed M roots on4 graphs;8/8 pairs on first proposal;0/128 successful futures. Degenerate bootstrap is not a population zero bound. Stop bounded reward-floor probe; no larger R5/cost study or training.
001-r5-branch-m-probe-v1	2026-09-14T06:55:18.174425+00:00	9df1226653d328effaff468d794121ad740dd785	configs/001_same_prefix_state/r5_branch_m_probe.json	890000000,910000000,1010000000	nebula	1779618,1778333,1780214,1780552	independent_B_selection_gain	0	success	inconclusive	/home/mlw0719/cola_dlm_exploration_storage/runs/001_same_prefix_state	8 fixed M roots on4 graphs;8/8 pairs on first proposal;0/128 successful futures. Degenerate bootstrap is not a population zero bound. Stop bounded reward-floor probe; no larger R5/cost study or training.
002-p0-v1	2026-09-14T19:19:49.847802+00:00	4393c75c32abe426bd1259312be7c7a59156d051	configs/002_task_consequence_basin/p0.json	20260914	nebula	2223799	paired_clean_worlds	16	success	keep	/home/mlw0719/cola_dlm_exploration_storage/runs/002_task_consequence_basin/002-p0-v1	16/16 paired-clean worlds;32/32 exact anchors;64/64 target endpoints;80 parser cases;native Euler parity and gradients pass. Cached raw logits differ by up to1.5 so scientific readout remains full fresh-cache. Engineering only.
002-runner-smoke-v1	2026-09-14T19:19:49.847802+00:00	d4a4b0a7e5cf9309397e6e03c99bc74cb8e30421	configs/002_task_consequence_basin/p0_runner.json	20260914	nebula	2228678	records	64	success	keep	/home/mlw0719/cola_dlm_exploration_storage/runs/002_task_consequence_basin/002-runner-smoke-v1	64 expected paired perturbation rows;16 worlds;noise seeds/RMS agree across queries and no duplicate record keys. Engineering only.
002-p1-dev-noise-v1	2026-09-14T19:41:39.619761+00:00	d4a4b0a7e5cf9309397e6e03c99bc74cb8e30421	configs/002_task_consequence_basin/p1_dev_noise.json	20260914	nebula	2236155,2236161,2236166,2236189	lexical_disagreement_at_nearest_grid_point	0.0200927734375	success	inconclusive	/home/mlw0719/cola_dlm_exploration_storage/runs/002_task_consequence_basin	64/64 paired-clean worlds;10240 readouts;no original sigma enters the3%-25% lexical band. One development-only grid refinement is required.
002-p1-dev-noise-refinement-v1	2026-09-14T19:41:39.620185+00:00	7f5315d5c3418896b454acc27ad1f56a68a5a2f5	configs/002_task_consequence_basin/p1_dev_noise_refinement.json	20260914	nebula	2246790,2246795	selected_sigma	0.4	success	keep	/home/mlw0719/cola_dlm_exploration_storage/runs/002_task_consequence_basin	64 worlds;7168 additional readouts;reuse original grid. sigma0.4 is nearest10% at8.181%;role effects are not used for selection.
002-sentence-dev-v1	2026-09-14T19:41:39.620565+00:00	494f083733948224514434b657cd0163e08e8824	configs/002_task_consequence_basin/p1_dev_sentence.json	20260914	nebula	2252222,2252228	selected_sigma	0.44	success	keep	/home/mlw0719/cola_dlm_exploration_storage/runs/002_task_consequence_basin	64/64 paired-clean worlds;13312 readouts. Separate sentence-format scale0.44 selected at12.144% lexical disagreement;not pooled with the record single-token layer.
002-search-dev-v1	2026-09-14T19:41:39.620642+00:00	ab3956f6d2bf21493f268c8e9251c09341c85a7d	configs/002_task_consequence_basin/p1_search_dev.json	20260914	nebula	2255341	backward_steps	1152	success	keep	/home/mlw0719/cola_dlm_exploration_storage/runs/002_task_consequence_basin	Two balanced development worlds;8 targets;1152 backward steps;51.21 seconds. Keep original128-world PGD/ray budget;defaults remain unchanged.
002-p1-test-noise-v1	2026-09-14T20:04:16.246866+00:00	ab3956f6d2bf21493f268c8e9251c09341c85a7d	configs/002_task_consequence_basin/p1_test_noise.json	20260914	nebula	2267500,2267505,2267510,2267515	primary_protection	-0.00048828125	success	keep	/home/mlw0719/cola_dlm_exploration_storage/runs/002_task_consequence_basin	256/256 paired-clean;32768 readouts;95% world interval[-0.0020751953125,0.001220703125].Initial parser-version readout;no positive role protection;blinded audit pending.
002-p1-test-search-v1	2026-09-14T20:04:16.246947+00:00	ab3956f6d2bf21493f268c8e9251c09341c85a7d	configs/002_task_consequence_basin/p1_test_search.json	20260914	nebula	2267520,2267525,2267530,2267535	combined_success_at_rms_0.4	1.0	success	keep	/home/mlw0719/cola_dlm_exploration_storage/runs/002_task_consequence_basin	128worlds;512targets;all exact endpoints;all found within RMS0.4;73728 backward steps;51104 native verifications.Search curve saturation is not nearest-boundary equivalence.
002-control-no_query-v1	2026-09-14T20:04:16.246985+00:00	a2f9ebab8a247ec52e9abd93d4935942600f5c17	configs/002_task_consequence_basin/control_no_query.json	20260914	nebula	2270739	paired_label_null	0.0	success	keep	/home/mlw0719/cola_dlm_exploration_storage/runs/002_task_consequence_basin	64paired-clean worlds;2048 role-labeled rows from1024 actual perturbation readouts.Exact input-identity null by construction.
002-control-query_only-v1	2026-09-14T20:04:16.247017+00:00	a2f9ebab8a247ec52e9abd93d4935942600f5c17	configs/002_task_consequence_basin/control_query_only.json	20260914	nebula	2270745	protection	0.00439453125	success	keep	/home/mlw0719/cola_dlm_exploration_storage/runs/002_task_consequence_basin	64paired-clean worlds;2048readouts;95%world interval[-0.00048828125,0.009765625].Source-removal diagnostic at main sigma0.4.
002-control-sentence-v1	2026-09-14T20:04:16.247048+00:00	a2f9ebab8a247ec52e9abd93d4935942600f5c17	configs/002_task_consequence_basin/control_sentence.json	20260914	nebula	2270750	protection	0.00390625	success	keep	/home/mlw0719/cola_dlm_exploration_storage/runs/002_task_consequence_basin	64paired-clean worlds;2048readouts;sigma0.44;95%world interval[0,0.0078125].Supplementary format/word-span control;sentence parser audit pending.
002-control-source_recoverability-v1	2026-09-14T20:04:16.247078+00:00	a2f9ebab8a247ec52e9abd93d4935942600f5c17	configs/002_task_consequence_basin/control_source_recoverability.json	20260914	nebula	2270734	correct_fields_after_replacement	0	success	keep	/home/mlw0719/cola_dlm_exploration_storage/runs/002_task_consequence_basin	64worlds;1152readouts;0/2304correct fields and allunparseable after zero or std4 Gaussian replacement.No observed source-only recovery.
002-p2-dev-recovery-v1	2026-09-14T20:04:16.247108+00:00	d4a4b0a7e5cf9309397e6e03c99bc74cb8e30421	configs/002_task_consequence_basin/p1_dev_recovery.json	20260914	nebula	2242824,2242830,2242836,2242843	selected_noise_fraction	0.5	success	keep	/home/mlw0719/cola_dlm_exploration_storage/runs/002_task_consequence_basin	64/64paired-clean;20480 real/rotated readouts;lexical15.205% atlambda0.5 selects index8 without role contrasts;nondegenerate working interval.
002-geometry-features-v1	2026-09-14T20:04:16.247139+00:00	edafcad7b3e3437d747cee945deea4db297a24d4	configs/002_task_consequence_basin/geometry_features.json	20260914	nebula	2284398	clean_geometry_features	512	success	keep	/home/mlw0719/cola_dlm_exploration_storage/runs/002_task_consequence_basin	128fixed boundary worlds;512clean gradients/confidence features;16.83seconds.Post-recovery auxiliary features;not a confirmatory outcome.
002-p2-cfg7-control-v1	2026-09-14T20:28:25.106157+00:00	a23ab19f66ee33a5b6a93fb68d3fc2bf97ff0e90	configs/002_task_consequence_basin/p2_cfg7_control.json	20260914	nebula	2293731,2293736,2293741,2293746	real_rotated_readouts	20480	success	keep	/home/mlw0719/cola_dlm_exploration_storage/runs/002_task_consequence_basin	64 fixed worlds;paired-clean=64;four native restart stages;eight seeds;four rotations;CFG7 control complete.Main CFG1 remains active;matched-world interpretation pending.
002-p2-test-recovery-v1	2026-09-14T21:35:46.439896+00:00	a23ab19f66ee33a5b6a93fb68d3fc2bf97ff0e90	configs/002_task_consequence_basin/p2_test_recovery.json	20260914	nebula	2293707,2293716,2293721,2293726	G_selective_primary	-0.00091552734375	success	close_core	/home/mlw0719/cola_dlm_exploration_storage/runs/002_task_consequence_basin/analysis-v2	256/256 paired-clean worlds; 81920 readouts; lambda=0.5 CFG1; CI95 [-0.0036026000976562495,0.001953125]; Holm p=1. Parser-v2 final analysis 52244c9. All four workers exit 0.
002-parser-audit-v2	2026-09-14T21:35:46.439896+00:00	52244c9c04a2e4628bd2a4b7678e5a55b0d6d812	scripts/rescore_task_basin.py	20260914	nebula		changed_field_types	659	success	keep	/home/mlw0719/cola_dlm_exploration_storage/runs/002_task_consequence_basin/rescored-v2	Assistant blind labels frozen at 2853772: original 195/200 fields agree, corrected 200/200; all 193728 records rescored; valid-wrong to unparseable only; zero total-damage changes; both primary tests exactly unchanged.
002-core-final-v2	2026-09-14T21:35:46.439896+00:00	52244c9c04a2e4628bd2a4b7678e5a55b0d6d812	scripts/run_task_basin_final_analysis.py	20260914	nebula		completed_formal_jobs	36	success	close_core	/home/mlw0719/cola_dlm_exploration_storage/runs/002_task_consequence_basin/analysis-v2	Both primary intervals inside +/-2 percentage points with nondegenerate world variation and ample error events. No task-selective protection supported. CFG-dependent general direction effect retained; no training or natural/native extension launched.
003-data-v1	2026-09-26T02:23:00.027623+00:00	daf81f98776d557f8ae110391bbf50584a685ab0	scripts/prepare_prefix_data.py	20260926	nebula	908794	prepared_prompts	0	crash	repair_loader	/home/mlw0719/cola_dlm_exploration_storage/runs/003_doob_speculative_decoding/003-data-v1	Preparation failure: datasets 5 rejects AlpacaEval Python builder. No scientific outcome.
003-data-v2	2026-09-26T02:25:56.351974+00:00	daf81f98776d557f8ae110391bbf50584a685ab0	scripts/prepare_prefix_data.py	20260926	nebula	910462	prepared_prompts	0	crash	repair_loader	/home/mlw0719/cola_dlm_exploration_storage/runs/003_doob_speculative_decoding/003-data-v2	Preparation retry used the old committed loader before the fix commit completed; same builder failure, no scientific outcome.
003-data-v3	2026-09-26T02:25:56.352324+00:00	94f830add613cd0788db3fd9421a352cbb69fb3b	scripts/prepare_prefix_data.py	20260926	nebula	910743	prepared_prompts	900	success	keep	/home/mlw0719/cola_dlm_exploration_storage/runs/003_doob_speculative_decoding/003-data-v3	Pinned prompt-only cohorts complete: 150 discovery, 150 validation, 600 final; final generation outcomes remain unopened.
003-s0-ar-tp4-v1	2026-09-26T02:38:43.646175+00:00	94f830add613cd0788db3fd9421a352cbb69fb3b	configs/003_doob_speculative_decoding/native.json	20260926	nebula	911136	completed_prompts	0	invalid	retry_on_orion	/home/mlw0719/cola_dlm_exploration_storage/runs/003_doob_speculative_decoding/003-s0-ar-tp4-v1	Cancelled stalled multi-GPU initialization before generation. Infrastructure outcome only.
003-s0-native-tp4-v1	2026-09-26T02:38:43.646175+00:00	94f830add613cd0788db3fd9421a352cbb69fb3b	configs/003_doob_speculative_decoding/native.json	20260926	nebula	911204	completed_prompts	0	invalid	retry_on_orion	/home/mlw0719/cola_dlm_exploration_storage/runs/003_doob_speculative_decoding/003-s0-native-tp4-v1	Cancelled stalled multi-GPU initialization before generation. Infrastructure outcome only.
